{"canonicalization":"artifactforge-canonical-json-v1","generator":{"abi":"artifactforge-fixture-generator-v1","name":"artifactforge","version":"0.5.0"},"payload":{"canonicalization":"artifactforge-fixture-tree-v1","file_count":11,"files":[{"path":"Amcache.hve","sha256":"sha256:53b43d8d1d2edf0c510ca3f2725607d9452fe4a50bc42cbd85cc6bf544b36e00","size":12288},{"path":"CTFMON_X64.EXE-156EFCE2.pf","sha256":"sha256:c324f0bcb175cbae7e9accbdd523c3ca5313794c1d3dfdcccf3f9e89d90d20ce","size":502},{"path":"GPUPD_HELPER.EXE-287D6206.pf","sha256":"sha256:3480b2a11f31e4b66b50f4d5bf7e57187f98988e7f3a24eb51e99a99b39e2608","size":506},{"path":"JAVAW.EXE-1DA9F6E6.pf","sha256":"sha256:d893fa55a4c34d6d9bc8809af2b2dd5d03381dde6c7064be4ea9a0055d942029","size":472},{"path":"OUTLOOK.EXE-021A91DB.pf","sha256":"sha256:84d5cb5fdfcd6c2630041ed532a096f700e095069bada5eec70d13ff0bdfe38b","size":470},{"path":"Software.run.hive","sha256":"sha256:73c6f494053c4df93b74fff75f1ddf22b1ecf2aa3972131b6541dc08ad643661","size":8192},{"path":"ctfmon_x64.exe","sha256":"sha256:86825da60362f2dab99d5cc5ff762bdf39706f07a0918d8dcff83167e0630962","size":2729},{"path":"javaw.exe","sha256":"sha256:949a3873838a0f4a99e748d30274e2d2e35608b4ca24886bf7eb6e06739221c3","size":2729},{"path":"notepad.exe","sha256":"sha256:7297da607b8aba9a2f5501d686d4a73135d9a8b0a6a0a81a11d7a89f1aa5e086","size":2729},{"path":"outlook.exe","sha256":"sha256:a173ffb7b6a62bd2e30ed1aebbab234611ace4dd79391fb076d32aa2ee1e677e","size":2729},{"path":"teams.exe","sha256":"sha256:9f3d375c82e14b6267e9b292379f8804b2dcfa980210885745118bd66f49adbc","size":2729}],"root":"artifacts","total_bytes":36075,"tree_sha256":"sha256:137ae0ca86fa660ef112cdf36f0a9192c57e1f7e5b1d736146b71004329f9891"},"purpose":{"benchmark_eligible":false,"kind":"public-reproducible-fixture"},"recipe":{"family":"windows","fixture_id":"windows-dropper-001","profile":{"hostname":"WKSTN-01","id":"windows-loose-v1","username":"v"},"purpose":"public-reproducible-fixture","schema":"artifactforge-fixture-spec-v1","seed_hex":"0123456789abcdef0123456789abcdef0123456789abcdef0123456789abcdef"},"recipe_sha256":"sha256:b62fa514ecffff5d847b2abf27f6c8a471b24487a0b595fbeb1a39177c438ff8","schema":"artifactforge-fixture-manifest-v1"}
