{"canonicalization":"artifactforge-canonical-json-v1","generator":{"abi":"artifactforge-fixture-generator-v1","name":"artifactforge","version":"0.5.0"},"payload":{"canonicalization":"artifactforge-fixture-tree-v1","file_count":9,"files":[{"path":"home/v/.bash_history","sha256":"sha256:a3c603d6b2f97ccf5b0b7c4453b9df10d1437e5b6cea7bb8fd9480e46d43ffe5","size":177},{"path":"home/v/.config/autostart/artifactforge-1-session-check.desktop","sha256":"sha256:30aeaa9e1f2487a2ecb1e6e46a7f4806e70d68bf610f0551b306268d6dc1fc71","size":247},{"path":"home/v/.config/autostart/artifactforge-2-theme-agent.desktop","sha256":"sha256:b1830c827842b0ed2bc7ee8c74d7d9fc0d6471fd3efd4174e13a9759f1e66fd2","size":245},{"path":"home/v/.config/autostart/artifactforge-3-profile-agent.desktop","sha256":"sha256:d76d82bc3586cc346a6c65a0d2671a10e65f5cc5a4020cd22d3d376053abcf52","size":247},{"path":"home/v/.local/bin/font-index","sha256":"sha256:fe7a74d61e0e9eaf474b79a42a01687d543cb5a2cbf32c7923a4a86522be7206","size":8784},{"path":"home/v/.local/bin/print-helper","sha256":"sha256:174a38bb8c6f3f7386ea67298186884d9917e62e09d98d6b52fa447018bc50fe","size":8784},{"path":"home/v/.local/bin/profile-agent","sha256":"sha256:62c4d3d12540548fd1ad5771645eadba7b5a185209e354142623231ee81a96db","size":8784},{"path":"home/v/.local/bin/session-check","sha256":"sha256:64dec881b31c21307d9ac56ca340f071f2fbcc66933434e08161804cb274b2bd","size":8784},{"path":"home/v/.local/bin/theme-agent","sha256":"sha256:ac05d4be788cca1d43f1e5178470afad1d00e07d48edc88021f7cd2c60edb4e0","size":8784}],"root":"artifacts","total_bytes":44836,"tree_sha256":"sha256:031ef526d9be376cb03dacb91b3b0dc2e3b1b9f7bafd35e03b58071fb65f9b8f"},"purpose":{"benchmark_eligible":false,"kind":"public-reproducible-fixture"},"recipe":{"family":"linux","fixture_id":"linux-autostart-001","profile":{"hostname":"linux-01","id":"linux-glibc-x86_64-loose-v1","username":"v"},"purpose":"public-reproducible-fixture","schema":"artifactforge-fixture-spec-v1","seed_hex":"89abcdef0123456789abcdef0123456789abcdef0123456789abcdef01234567"},"recipe_sha256":"sha256:893e029f80a29628420f11ca6b10d4c17b9c37e2e826e8ba8325525e7501c8a3","schema":"artifactforge-fixture-manifest-v1"}
