{"canonicalization":"artifactforge-canonical-json-v1","generator":{"abi":"artifactforge-fixture-generator-v1","name":"artifactforge","version":"0.5.0"},"payload":{"canonicalization":"artifactforge-fixture-tree-v1","file_count":16,"files":[{"path":"QuarantineEventsV2","sha256":"sha256:8fcfa6b4b4029210ebb7139cb18af1f967ad68a3dac034ab0325a7474ddc4eb7","size":16384},{"path":"TCC.db","sha256":"sha256:17cd581a23661ac5489c78a3a56bd4bb2e890188e7792079ddccd94a7e9e17eb","size":12288},{"path":"com.stonewick.design","sha256":"sha256:e81b8ba1bd42f46656fd845a41186b236699f46365d1acfb13dbc77f63c063c0","size":33696},{"path":"com.stonewick.design.plist","sha256":"sha256:6a8bc6ebb8bc73ee4466d27689073bc917273f7962e59d812be9775ad1b216e0","size":521},{"path":"com.stonewick.design.quarantine.xattr","sha256":"sha256:da91e6b89ab7b6582b3fe9469bfd7699bb3ac2478ec0403184a656c428be07f0","size":58},{"path":"com.westvane.browser","sha256":"sha256:3d360f1aa9b8f711fd07ad3064a8b143c16299551a6761355e2c518c7ae97b6c","size":33488},{"path":"com.westvane.browser.quarantine.xattr","sha256":"sha256:0c2067f72c16d4cd21ea6b2292d82b24f1e1eb457e8dc6ea5e722b4af1569c4b","size":58},{"path":"knowledgeC.db","sha256":"sha256:2d89293ff23b1438b0248cf46f4e1b23d3d8ba5a0640c3abc08280c57d565ac4","size":12288},{"path":"net.saltmarsh.node","sha256":"sha256:eb1c12b0e0cddbac61387cbbc04f49606d8b5e3618ed1b60dec532aa15f17ed7","size":33392},{"path":"net.saltmarsh.node.plist","sha256":"sha256:09902a04bbf9fe0154d88f6190202af5ecb7de823a84f05ccf25552ec75b62bf","size":515},{"path":"net.saltmarsh.node.quarantine.xattr","sha256":"sha256:70226485a96294790910ca66eff9dc8adcfca4d2cb7524675aa13529df8407a8","size":58},{"path":"org.embergrove.tool","sha256":"sha256:6b2420a232b7c878d11592ae1010254fb68e983a9b29a541b58445cff80262a9","size":33728},{"path":"org.embergrove.tool.quarantine.xattr","sha256":"sha256:b8a9286281008bb6f85d23b5aed388c3122bbbb4848cc9b9e89f184ccc3c4712","size":58},{"path":"org.wavecrest.tool","sha256":"sha256:29991a5f7a264712486219cfc4163d7541a6179cee7ec47b72171b21ec5f69ac","size":33568},{"path":"org.wavecrest.tool.plist","sha256":"sha256:0a0ea48578805b49c59b6f97b782b174926781b7804d54cb84b2b2b77d0d61f9","size":515},{"path":"org.wavecrest.tool.quarantine.xattr","sha256":"sha256:ba242be18893b34e71ee3ba20c0279323c04c195aa2f16cfe558844518a57775","size":58}],"root":"artifacts","total_bytes":210673,"tree_sha256":"sha256:0a05f1639ec88324102cd8552104db00822fb85427704468deac7897c3a7af8b"},"purpose":{"benchmark_eligible":false,"kind":"public-reproducible-fixture"},"recipe":{"family":"macos","fixture_id":"macos-quarantine-001","profile":{"hostname":"mac-01","id":"macos-14-loose-v1","username":"v"},"purpose":"public-reproducible-fixture","schema":"artifactforge-fixture-spec-v1","seed_hex":"fedcba9876543210fedcba9876543210fedcba9876543210fedcba9876543210"},"recipe_sha256":"sha256:88020829d2639a39374a18e2178cea4ed2a3d1bd5216c804ea1384f152332dc6","schema":"artifactforge-fixture-manifest-v1"}
